{
  "id": "circle_test",
  "bbox": { "x": -30, "y": -30, "w": 60, "h": 60 },
  "primitives": [
    { "kind": "circle", "cx": 0, "cy": 0, "r": 20, "fill": false },
    { "kind": "circle", "cx": 0, "cy": 0, "r": 5, "fill": true }
  ],
  "pins": [
    { "name": "C", "pos": { "x": -20, "y": 0 }, "dir": "left" },
    { "name": "D", "pos": { "x": 20, "y": 0 }, "dir": "right" }
  ]
}
