{
  "id": "arc_test",
  "bbox": { "x": -30, "y": -30, "w": 60, "h": 60 },
  "primitives": [
    { "kind": "arc", "cx": 0, "cy": 0, "r": 20, "startAngle": 0, "endAngle": 90, "fill": false, "width": 2 },
    { "kind": "arc", "cx": 0, "cy": 0, "r": 15, "startAngle": 180, "endAngle": 270, "fill": false, "width": 2 },
    { "kind": "text", "x": 0, "y": -25, "text": "Arc 0°-90°", "anchor": "c", "size": 5 }
  ],
  "pins": [
    { "name": "start", "pos": { "x": 20, "y": 0 }, "dir": "right" },
    { "name": "end", "pos": { "x": 0, "y": -20 }, "dir": "up" }
  ]
}
