{
  "id": "R",
  "bbox": { "x": -60, "y": -20, "w": 120, "h": 40 },
  "primitives": [
    { "kind": "line", "a": { "x": -60, "y": 0 }, "b": { "x": -30, "y": 0 } },
    { "kind": "polyline", "points": [
      { "x": -30, "y": 0 },
      { "x": -20, "y": -10 },
      { "x": -10, "y": 10 },
      { "x": 0, "y": -10 },
      { "x": 10, "y": 10 },
      { "x": 20, "y": -10 },
      { "x": 30, "y": 0 }
    ] },
    { "kind": "line", "a": { "x": 30, "y": 0 }, "b": { "x": 60, "y": 0 } },
    { "kind": "text", "x": 0, "y": -18, "text": "R", "size": 10, "anchor": "c" }
  ],
  "pins": [
    { "name": "1", "pos": { "x": -60, "y": 0 }, "dir": "left" },
    { "name": "2", "pos": { "x": 60, "y": 0 }, "dir": "right" }
  ]
}
